<?xml version="1.0" encoding="UTF-8"?>
<story xmlns="http://www.example.org/storySchema" xmlns:xsi="http://www.w3.org/2001/XMLSchema-instance"
	xsi:schemaLocation="http://www.example.org/storySchema ../storySchema.xsd ">
	<scene id="intro1">
		The world shifts and rolls around you, shadows and images fading in
		and out, unseen and unnoticed. While you cannot quite percieve the
		details of the land before you, you can begin to feel its scope.
		<br />
		<br />
		This rolling, shifting land is your dreamscape, where you live when
		you sleep, and where you die when you wake. Here you are are lord and
		ruler, you are god made flesh, and this world is yours to command.
		<br />
		<br />
		How would you command it?
	</scene>
	<scene id="intro2">
		You summon the command into your mind and allow it to take form. You
		visualize it around you, becoming reality. Once you feel ready to make
		it happen, you stretch your hands out and attempt to mold the world.
		<br />
		<br />
		But it doesn't work. As soon as you try to
	</scene>
	<scene id="intro3">
		You are
		<var name="game.pcHeightWithUnits()" />
		tall. That means that you are
		<cond>
			<if logic="gte(game.pcHeight, 6)">
                tall.
            </if>
			<elseif logic="lte(game.pcHeight, 4)">
                short.
            </elseif>
			<else>
                normal height.
            </else>
		</cond>
	</scene>
</story>
